body,subreddit_comment,created_utc_comment,Processed_body
"That doesn't sound good at all! That's another reason I chose a TL over Essure: I didn't want to feel a damn thing. Poor you! Hope you feel better soon, and congrats on shutting down the baby factory!",childfree,2012-08-23 00:04:03,sound good another reason chose tl want feel damn thing poor hope feel better soon congrats shutting baby factory
"I had my essure about a year ago and I had no idea people hated it so much until after I had it done. Scared the shit outta me once I started to read the horror stories. But here I am, almost a year later and I have had zero discomfort. And the procedure was so quick and easy that I was doing normal things, walking around and what not, the same day.  I loved it, I would bring this up these concerns with your doctor though. Best of luck!",childfree,2015-06-02 03:10:32,year ago idea people hated much done scared shit outta started read horror story almost year later zero discomfort procedure quick easy normal thing walking around day loved bring concern doctor though best luck
"Congrats! And I'm going to have to jump on the bandwagon and totally steal your No Baby Shower idea.  I'm going to ask my doctor about Essure when I visit her next, and if she agrees, I'm definitely throwing a party!  I hope the procedure goes well.. best wishes!",childfree,2012-12-10 15:18:06,congrats going jump bandwagon totally steal baby shower idea going ask doctor visit next agrees definitely throwing party hope procedure go well best wish
"Yeah I'm not so sure about all that stuff about Essure. I'd take it with a grain of salt. If you want permanent birth control plus reduction or cessation of periods, ask about a tubal plus endometrial ablation (trade name: Novasure). That combo will do the trick.",childfree,2016-03-01 02:33:16,yeah sure stuff take grain salt want permanent birth control plus reduction cessation period ask tubal plus endometrial ablation trade name novasure combo trick
"Okay, so this is not an easy topic to google without finding dozens of blog posts and ""news articles"" written by people foaming at the mouth over 'Obamacare' and 'the death of religious freedom' (eyeroll). But here's the bits that I was able to find:

&gt;What types of birth control are now covered with no cost sharing? The full range of FDA-approved prescription contraceptive methods are included. This means women can access oral contraception (the Pill), the shot (Depo-Provera), the ring (Nuvaring), contraceptive implants, diaphragms, cervical caps and **permanent contraceptive methods, like tubal ligation,** without paying a co-payment or having the costs applied to her deductible. [link](http://www.nwlc.org/sites/default/files/pdfs/contraceptive_coverage_faq_11.9.11.pdf)


&gt;Conceptus, Inc. (Nasdaq:CPTS), developer of the Essure® procedure, the leading non-surgical permanent birth control method, today announced that as a result of the decision by the U.S. Supreme Court to uphold the majority of the Patient Protection and Affordable Care Act of 2010 (ACA), including the preventive health services provisions, all U.S. Food and Drug Administration approved contraceptive methods **including permanent birth control such as the Essure procedure must be made available without cost to women in all private insurance plans**. [link](http://www.globenewswire.com/newsroom/news.html?d=260724)",childfree,2012-08-02 02:53:04,okay easy topic google without finding dozen blog post news article written people foaming mouth death religious freedom eyeroll bit able find gt type birth control covered cost sharing full range prescription contraceptive method included mean woman access oral contraception pill shot ring nuvaring contraceptive implant diaphragm cervical cap permanent contraceptive method like tubal ligation without paying cost applied deductible link gt conceptus nasdaq cpts developer procedure leading permanent birth control method today announced result decision supreme court uphold majority patient protection affordable care act aca including preventive health service provision food drug administration approved contraceptive method including permanent birth control procedure must made available without cost woman private insurance plan link
"It looks like this [(http://blog.chakabox.com/2009/11/essure.html)] except curved since it was used (I assume). I am leaving the other one in, but not doing the dye test, I figure why deal with that pain when I know that one is not even there. 

My gyn told me that I am the first person that this has happened to under her care. Way to go me! I'm special :)  She said that it's a possibility and that they can reinsert it, but I have no intention of going through more pain to have it possibly fall out again. 

Husband has agreed to get snipped. That will solve our problem for now. I'm still on BC for regularity in my cycle so we'll have double protection. 

Unfortunately I still have cramping on the right side. (Which I'm pretty sure is the side that fell out). I was having cramping the week before it came out and every once and a while I'll feel a sharp pain or a dull cramp for a bit. 

The good thing is that I'm the exception, not the rule. But since it did happen, I wanted to share. 

Edit:  Forgive me, I don't know how to name the link. I suck at the interwebs :) ",childfree,2012-06-20 00:14:59,look like except curved since used assume leaving one dye test figure deal pain know one even gyn told first person happened care way special said possibility reinsert intention going pain possibly fall husband agreed snipped solve problem still bc regularity cycle double protection unfortunately still cramping right side pretty sure side fell cramping week came every feel sharp pain dull cramp bit good thing exception rule since happen wanted share edit forgive know name link suck interwebs
"An ablation is actually NOT a reliable method of birth control - you can still get pregnant, only now the embryo is much more likely to pass through the uterine wall and attach to your colon or something.

Essure and the like are much better options. ",childfree,2013-01-26 14:01:23,ablation actually reliable method birth control still pregnant embryo much likely pas uterine wall attach colon something like much better option
"This is absolutely true.  I got mine with the second doc I saw - I got Essure and I love it but apparently a ton of other ladies were not as fortunate which is sad since it was minimally invasive.

The childfree subreddit maintains a list of doctors that are friendly towards people seeking sterilization.  I had mine at age 24, 32 and still no ragrats.",TwoXChromosomes,2022-05-15 05:40:35,absolutely true got mine second doc saw got love apparently ton lady fortunate sad since minimally invasive childfree subreddit maintains list doctor friendly towards people seeking sterilization mine age still ragrats
I wonder have you looked into essure?,TwoXChromosomes,2014-02-12 05:47:46,wonder looked
"THANK YOU.  I wish I could upvote this more than once.

My in-laws were firmly in the ""gimme grandkids"" camp from the day we got married until I got Essure and my husband (an only child) told his parents they weren't getting any grandchildren.",childfree,2020-03-21 20:43:09,thank wish upvote firmly gim grandkids camp day got married got husband child told parent grandchild
"Its a form of sterilization, here is the site if you want info http://www.essure.com/",birthcontrol,2013-02-20 03:43:57,form sterilization site want info
"Thank you! I'm glad you were able to get yours done too! I considered the Essure (coils), but it was no longer being offered. I hope that these options get more accepted for those in their twenties as well.",childfree,2019-08-26 22:02:49,thank glad able done considered coil longer offered hope option accepted twenty well
"Doctors will recommend Progesterone Only and Hormone Free methods if there is a clot r stroke risk. Its the Oestrogen in Birth Controls that effect the risk of clotting, so birth control without oestrogen is safe to take provided the woman is attempting to live a balanced lifestyle, and gets her BP checked regularly.

So there are some options.

Hormonal:

* [Progesterone only Pills \(Mini Pills\)](http://en.wikipedia.org/wiki/Progestogen-only_pill) Avaliable in several brands and Formulations.

* [Depo Povera \(Injection\)](http://www.drugs.com/pro/depo-provera.html)

* Contraceptive Implant [Implanon NXT](http://www.implanon.com/) Or [Nexplanon](http://www.nexplanon-usa.com/en/consumer/index.asp) (Same product, Different countries)

* [IUD with Prigesterone](http://en.wikipedia.org/wiki/IUD_with_progestogen) Such as The [Mirena](http://www.mirena-us.com/index.php) Or [Skyla](http://www.skyla-us.com/index.php)

Non Hormonal:

* Barried Methods like [Condoms](http://en.wikipedia.org/wiki/Condom) or [Femidoms](http://en.wikipedia.org/wiki/Female_condom) or [diaphragms](http://en.wikipedia.org/wiki/Diaphragm_\(contraceptive\)) or [cervical caps](http://en.wikipedia.org/wiki/Cervical_cap)

* Chemical methods like [Spermacide](http://en.wikipedia.org/wiki/Spermicide), [VCF](http://vcfcontraceptive.com/) or [Today Sponge](http://todaysponge.com/)

* [IUD with copper](http://en.wikipedia.org/wiki/IUD_with_copper) such as [Paragard](http://www.paragard.com/)

Permanent Methods

* Procedural Tube Blocking [Essure](http://www.essure.com/) 

* Surgical tube cutting [Tubal Ligation](http://en.wikipedia.org/wiki/Tubal_ligation)

* Removal of reproductive organ, [Hysterectomy](http://en.wikipedia.org/wiki/Hysterectomy)  or [Oophorectomy](http://en.wikipedia.org/wiki/Oophorectomy)

Lifestyle Methods: (High Failure Rate)

* [Fertility awareness](http://en.wikipedia.org/wiki/Fertility_awareness) including [Rhythm Method](http://en.wikipedia.org/wiki/Calendar-based_contraceptive_methods) and [Lady Comp](http://www.lady-comp.com/en/)

* [Withdrawal Method](http://en.wikipedia.org/wiki/Coitus_interruptus)  and Non-penetrative Ejaculation

* Abstinance",birthcontrol,2013-11-01 02:15:13,doctor recommend progesterone hormone free method clot r stroke risk oestrogen birth control effect risk clotting birth control without oestrogen safe take provided woman attempting live balanced lifestyle get bp checked regularly option hormonal progesterone pill mini avaliable several brand formulation depo povera contraceptive implant implanon nxt nexplanon product different country iud prigesterone mirena skyla non hormonal barried method like condom femidoms diaphragm cervical cap chemical method like spermacide vcf today sponge iud copper paragard permanent method procedural tube blocking surgical tube cutting tubal ligation removal reproductive organ hysterectomy oophorectomy lifestyle method high failure rate fertility awareness including rhythm method lady comp withdrawal method ejaculation abstinance
"Just to clarify for anyone who doesn't know what Essure is,  it is still a permanent form of birth control.  It scars the fallopian tubes, causing blockage, thus preventing contact between egg and sperm.  :) 

Edit: the scarring is performed by coils that are implanted into your fallopian tubes. The coils remain in your body. ",TwoXChromosomes,2015-08-20 21:38:36,clarify anyone know still permanent form birth control scar fallopian tube causing blockage thus preventing contact egg sperm edit scarring performed coil implanted fallopian tube coil remain body
"First of all - as others have said, this doctor is not doing his job. If he's in a hospital setting or working as part of a practice that he doesn't own, please make a complaint. If he owns his own practice, leave a scathing yelp review. Also, this looks like it may have some useful info on how to file a complaint when a physician has denied you medical treatment:

http://www.ama-assn.org/ama/pub/physician-resources/medical-ethics/code-medical-ethics/frequently-asked-questions.page

Second, even though that particular doc was jerk, there are plenty of docs who will perform tubals/Essure on CF women your age, particularly if you don't handle hormonal BC well. There's a small list of CF-friendly docs in the sidebar. Also, urban/university docs seem to be more CF-friendly in my (admittedly limited) experience, and Planned Parenthood is another good option.  When you make an appointment with a new doctor, it's totally fine to ask if any of the doctors at the practice are willing to perform sterilization procedures on women without children. It might save you some time, money and anger.

Side note - I've seen lots of anecdotal reports on reddit/other internet places of Mirena causing depression and other psychological symptoms. I'm not mentioning that to scare you, because lots of women have no problems with it, but please discuss this with your fiance/family/close friends/whoever, and make sure they know to take action if they notice any unusual changes in your mood or personality. They may very well notice that something's wrong before you do.",childfree,2013-03-06 15:32:43,first others said doctor job hospital setting working part practice please complaint owns practice leave scathing yelp review also look like may useful info file complaint physician denied medical treatment second even though particular doc jerk plenty doc perform cf woman age particularly handle hormonal bc well small list doc sidebar also doc seem admittedly limited experience planned parenthood another good option appointment new doctor totally fine ask doctor practice willing perform sterilization procedure woman without child might save time money anger side note seen lot anecdotal report internet place mirena causing depression psychological symptom mentioning scare lot woman problem please discus sure know take action notice unusual change mood personality may well notice something wrong
"Essure was a bust for me because my tubes didn't scar shut. AT ALL. After I had the coils placed, my gyno told me that my tubes should scar shut in 3 months. Well, three months later, I'm in to do the dye imaging. Neither of the tubes are closed. We still wanted to get the ablation done. But, the day I was supposed to have it done, doctors found a blood clot in my leg and a saddle pulmonary embolism in both lungs. Goodbye gyno and hello , ICU.",childfree,2014-01-08 21:43:24,bust tube scar shut coil placed gyno told tube scar shut month well three month later dye imaging neither tube closed still wanted ablation done day supposed done doctor found blood clot leg saddle pulmonary embolism lung goodbye gyno hello icu
"Came here to say nobody's bathroom sink is that deep. Also, why do they all look the same age?

""Essure: For when you've delivered your IVF-induced litter and you're done with the whole lot of it.""",childfree,2014-04-01 02:42:39,came say nobody bathroom sink deep also look age delivered litter done whole lot
"Thanks for sharing, I read through your experience post. I'm thinking about the Essure mostly because the thought of undergoing surgery scares the crap out of me =[.",childfree,2014-08-07 11:29:44,thanks sharing read experience post thinking mostly thought undergoing surgery scare crap
ive been considering essure! have you had any side effects/how was recovery? i feel like the info i read online really highlights the bad and it scares me. also wondering if a doctor would even do it at my age (21 in NYC),childfree,2020-09-22 00:45:26,ive considering side recovery feel like info read online really highlight bad scare also wondering doctor even age nyc
"I'm totally doing this. I ordered my stork pinata yesterday, and some candy molds. I'm going to make all the guests little gift bags filled with condoms, a Slinky (lol), and chocolate candy shaped like scissors and [birth control pills](http://www.ebay.com/itm/Parents-BIRTH-CONTROL-PILL-CASE-Chocolate-Candy-Mold-/200397785114). Since I'm calling it a ""Golden Snip Party"" (although technically it won't be a ""snip"" since I'm getting Essure) I'm painting the candy scissors with edible gold metallic spray.

Decoration-wise there's going to be coil-shaped confetti and silver hanging swirls with [these](http://www.slate.com/content/dam/slate/blogs/xx_factor/2012/06/12/_choosing_to_be_child_free_babies_are_alien_parasites_/1339512217707.jpg.CROP.article250-medium.jpg) on them. Gag gifts to be won from the two or three silly games I have planned include Giant Microbes Sperm/Egg cell plushies. The rest of the party will be spent drinking, eating cake, and playing Cards Against Humanity or other card/board games from my BF's extensive collection. It's going to be awesome. I just wish I knew more childfree people in RL to invite.",childfree,2013-07-08 16:10:37,totally ordered stork pinata yesterday candy mold going guest little gift bag filled condom slinky lol chocolate candy shaped like scissors birth control pill since calling golden snip party although technically wo snip since painting candy scissors edible gold metallic spray going confetti silver hanging swirl gag gift two three silly game planned include giant microbe cell plushies rest party spent drinking eating cake playing card humanity game bf extensive collection going awesome wish knew childfree people rl invite
"I didn't have Essure because I'm allergic to nickel and it's not recommended for patients who are sensitive to nickel. So that's something to be tested for, if you are considering Essure.

Also check this: [FDA restricts sale and distribution of Essure to protect women and to require that patients receive risk information](https://www.fda.gov/NewsEvents/Newsroom/PressAnnouncements/ucm604098.htm)",childfree,2018-04-21 03:51:35,allergic nickel recommended patient sensitive nickel something tested considering also check fda restricts sale distribution protect woman require patient receive risk information http
"I chose Essure over the ligation because I'm overweight and my doc was concerned about cutting into my abdomen. That said, I would rather have had a typical tubal ligation because I have had many complications with the Essure. Constant back cramps(like labor), random ""I'm being knifed in the lady bits"" pains, my cycle is now every 3 weeks, periods are so heavy I don't dare leave my home, and I now have PMS thus ending my streak of being a lucky bitch. 
",childfree,2013-07-07 21:46:31,chose ligation overweight doc concerned cutting abdomen said rather typical tubal ligation many complication constant back cramp like labor random knifed lady bit pain cycle every week period heavy dare leave home pm thus ending streak lucky bitch
"In all honesty, the Essure site is a great place for more info on Essure. They have some really good educational videos and eligibility info. If you haven't had kids they're kind of wary of sterilizing you. It really depends on your age and how long you've been married.",birthcontrol,2013-04-01 14:29:18,honesty site great place info really good educational video eligibility info kid kind wary sterilizing really depends age long married
"Were you given anything to accompany the procedure that could affect your period? For example, I was given a double dose of depo which made me bleed for 3 months straight with the Essure. This would be a great question for your doctor.",birthcontrol,2014-12-02 04:35:26,given anything accompany procedure affect period example given double dose depo made bleed month straight great question doctor
"having a UID fail can be quite traumatic.  My wife's UID failed after 3 years in 2012.  We already had 2 kids, and our family was complete.

deciding whether or not to have the third child was very difficult for our family.  I'm very happy for you that you got the abortion and can now look at  moving forward in your life.  

My wife now has the essure and I've had the V.  we decided to not mess around anymore. we are both out of commission, should one of our bodies ""heal"" there's the other person backup.

",childfree,2017-05-27 00:21:10,uid fail traumatic wife uid failed year already kid family complete deciding whether third child difficult family happy got abortion look moving forward life wife decided mess around anymore commission one body heal person backup
"(If in the US, sorry idk enough about health systems in other countries to give any good advice) The first step is to find an OBGYN who would be willing to perform the surgery. Check out the doctors list on the CF side bar. Make an appointment or call in advance to confirm they're willing. Either way you'll have to have at least one pre-op consultation. You shouldn't need a family doctor since OBGYNs are considered primary care doctors. If you have concerns about insurance, call your members services number (on the back of your card) and ask about OBGYNs in your area who are in-network.

Types of procedures available:

1. Bilateral salpingectomy: completely remove both tubes. Laparoscopic surgery; lowest rate of failure (no recorded viable pregnancies in history); added benefit of reducing rates of ovarian cancer (which can start in the tube). This is becoming the most favored option by doctors. Uterus remains meaning periods continue and pregnancy via IVF is possible.

2. Bilateral tubal ligation (""tubes tied""): cut/burn tubes to prevent egg from meeting sperm. Laparoscopic surgery; very low rate of failure, but viable pregnancies have happened (though more likely to have a tubal pregnancy); Uterus remains. This is also a very common choice.

3. Essure: metal coils inserted inside each tube to cause inflammation and scar tissue, blocking sperm from reaching eggs. Hysteroscopic (through the vagina/cervix/uterus); advantage of not opening up the abdomen (might be good for those with previous surgeries/scar tissue). Falling out of favor due to allergies to the metal used, will probably be difficult to find a doctor to do this. Uterus remains.

4. Hysterectomy: completely remove uterus (+/- cervix). Usually laparoscopic with the uterus ""delivered"" vaginally. This is considered MAJOR surgery and will be EXTREMELY difficult to get without another medical reason (fibroids, hemorrhage, certain cancers, etc.). The uterus is gone, meaning no more periods and IVF pregnancy is impossible.

Good luck!",childfree,2018-07-23 02:07:24,u sorry idk enough health system country give good advice first step find obgyn willing perform surgery check doctor list cf side bar appointment call advance confirm willing either way least one consultation need family doctor since obgyns considered primary care doctor concern insurance call member service number back card ask obgyns area type procedure available bilateral salpingectomy completely remove tube laparoscopic surgery lowest rate failure recorded viable pregnancy history added benefit reducing rate ovarian cancer start tube becoming favored option doctor uterus remains meaning period continue pregnancy via ivf possible bilateral tubal ligation tube tied tube prevent egg meeting sperm laparoscopic surgery low rate failure viable pregnancy happened though likely tubal pregnancy uterus remains also common choice metal coil inserted inside tube cause inflammation scar tissue blocking sperm reaching egg hysteroscopic advantage opening abdomen might good previous tissue falling favor due allergy metal used probably difficult find doctor uterus remains hysterectomy completely remove uterus cervix usually laparoscopic uterus delivered vaginally considered major surgery extremely difficult without another medical reason fibroid hemorrhage certain cancer uterus gone meaning period ivf pregnancy impossible good luck
