body,subreddit_comment,created_utc_comment,Processed_body
"thanks!

I'm on the pill, and plan to stay on it in addition to removing the tubes. One of the reasons I want this salpingectomy, is that the future is very uncertain, especially in terms of access to contraception and abortion, among other women's rights. I travel a lot, and the places I go to might make contraception illegal in the coming years, so I don't want to depend on pills to live freely. They are merely there to keep my hormones under control.

I wonder if the uterus will be ""angry"" (sounds so cute!) if I'm on the pill; technically it shouldn't notice any changes, since I haven't ovulated for the last decade :D or is it related to something else?...

I have an appointment tomorrow with a gyno. He performed Essure on a friend, no bingoes, no judgement, just pay whatever the insurance doesn't cover and he does his job. She's very satisfied, we'll see how it goes... if he agrees to do the procedure, I'll have to wait 4 months (it's the law here)... fingers crossed!",childfree,2016-03-04 14:21:56,thanks pill plan stay addition removing tube one reason want salpingectomy future uncertain especially term access contraception abortion among woman right travel lot place might contraception illegal coming year want depend pill live freely merely keep hormone control wonder uterus angry sound cute pill technically notice change since ovulated last decade related something else appointment tomorrow gyno performed friend bingoes judgement pay whatever insurance cover job satisfied see go agrees procedure wait month law finger crossed
"my periods after Essure were much heavier and more painful. I had headaches, cramping like I had never had before. ",childfree,2013-06-17 11:31:17,period much heavier painful headache cramping like never
"Most of the stuff I've read about Essure mentions that it's hard to get the placement right the first time and that a lot of people have had to go back in to get it adjusted. That being said, at least they don't have to put you under.",childfree,2013-11-27 23:30:58,stuff read mention hard placement right first time lot people back adjusted said least put
"OMG I love it!  :)

After I got Essure, I was worried that I wouldn't be able to clear airport security without a patdown, because the Essure implants are made with nickel.  Since I got the procedure \*mumble\* years ago, I've been stopped exactly once - and it was because I had a bottle of water in my carry-on that I'd forgotten about.  LOL",childfree,2022-07-28 03:47:21,omg love got worried able clear airport security without patdown implant made nickel since got procedure year ago stopped exactly bottle water forgotten lol
"Ha. Sorry. I have heard other stories about Essure; one lady was ill for a week. Sure, vasectomy takes a few days too. 

I guess we'll need a bigger sample number... I think they might come out about even and that's ok. ",childfree,2014-07-26 11:42:24,ha sorry heard story one lady ill week sure vasectomy take day guess need bigger sample number think might come even ok
"oh? I thought it takes longer than essure, because it is a surgery unlike essure. But good to know, thank you for the correction. :) 

And the chance of getting pregnant with sterilisation is abysmal, less than 1% in all of them. :P But what I was referring more was about that in case of essure they will be able to check it in 3 months if the tissue has formed correctly. I haven't (yet) read of essure that would have somehow reverted after that, but in the case of clips they can move (in very very rare cases) and in the case of cutting the ends can grow back together.",childfree,2015-04-03 19:02:10,oh thought take longer surgery unlike good know thank correction chance pregnant sterilisation abysmal less p referring case able check month tissue formed correctly yet read somehow reverted case clip move rare case case cutting end grow back together
Just my essure placement a few months ago was $26K! Thank god I only had to pay about $200 out of pocket for copays and pain pills. ,childfree,2015-12-30 18:57:28,placement month ago thank god pay pocket copays pain pill
"I have to say, I don't really find that too insulting to ask, it could also be asking if someone has started menopause, right?

I think its important to tread the line of not being oversensitive while also not letting anyone say anything that is actually inappropriate or offensive.

Even your initial situation, just asking what ""Essure"" was and then having a facial reaction really isn't an offense to anyone who isn't being overly sensitive to the subject. ",childfree,2016-06-21 19:14:43,say really find insulting ask also asking someone started menopause right think important tread line oversensitive also letting anyone say anything actually inappropriate offensive even initial situation asking facial reaction really offense anyone overly sensitive subject
"I know everyone else addressed the honesty thing, but definitely do substantial research into Essure versus removal of a section of your tubes. There are a lot of articles being posted about Essure in a negative light - even in this sub. Just really dig in about which method you choose and make sure you have all the info. (Note: this is to be helpful, not to assume you have not done any research and were going to dive in head first knowing nothing about nothing :)

&gt;Edit: down to done",childfree,2014-10-14 22:32:06,know everyone else addressed honesty thing definitely substantial research versus removal section tube lot article posted negative light even sub really dig method choose sure info note helpful assume done research going dive head first knowing nothing nothing gt edit done
"Don't get Essure! Seriously just google essure, I don't feel like typing out the multitudinous problems. Tubal ligation or bilateral salpingectomy would be the safest, but if you can't find a reasonable doctor (look at the sidebar in r/childfree they have lists of people who will do these) go for anything progesterone only. Depo shot has worked well for me, but it's hit and miss with people over all. Progestin pills you have to be *extremely* consistent with taking them on time for them to be effective, which is why combo pills are most popular. ",birthcontrol,2018-11-01 19:01:37,seriously google feel like typing multitudinous problem tubal ligation bilateral salpingectomy safest ca find reasonable doctor look sidebar list people anything progesterone depo shot worked well hit miss people progestin pill extremely consistent taking time effective combo pill popular
essure was the best choice ever for me and totally covered by affordable care act but I am insured so not sure about the cost without insurance.  I would recommend this process regardless. ,childfree,2016-01-31 09:01:48,best choice ever totally covered affordable care act insured sure cost without insurance recommend process regardless
"Good luck! There are lots of great threads about success stories, let's hope you're one of them. If you're considering Essure, carefully read about the FDA reviewing if it's really a safe option. Sorry, possibly unwanted advice, but please be informed :)",childfree,2015-06-27 17:22:31,good luck lot great thread success story let hope one considering carefully read fda reviewing really safe option sorry possibly unwanted advice please informed
"Yup, it's pretty annoying. 

I'll have an Essure sterilisation done in a few weeks at a private clinic because my regular gyno wouldn't do it. Got the same bullshit about how I'll be sorry (I'm 35 and overweight by the way, if I want to have kids, I'll probably have a high-risk pregnancy - guess my gyno rather sees me high-risk pregnant than happy?). 

In the end I'm just glad I found a gyno, though! It's such a relief if people tell you that they know you are actually capable of making a decision about your own body. Good luck on your search... ",childfree,2014-07-26 11:40:39,yup pretty annoying sterilisation done week private clinic regular gyno got bullshit sorry overweight way want kid probably pregnancy guess gyno rather see pregnant happy end glad found gyno though relief people tell know actually capable making decision body good luck search
"In my 20s: I'd burn rubber driving to the nearest abortion clinic.

In my 30s: I'd burn rubber driving to the ER.  (I had Essure when I was 32, so any pregnancy would be an ectopic pregnancy.)

In my 40s: My oncologist would get a paper published.  I was diagnosed with breast cancer at 43, and, as a result of chemo, my eggs are fried.  Also, since I live in a red state where abortion is illegal except to save the pregnant person's life, I'd burn rubber driving to the airport to hop a plane where sanity has prevailed and abortion is still legal.",childfree,2022-10-18 05:04:40,burn rubber driving nearest abortion clinic burn rubber driving er pregnancy ectopic pregnancy oncologist paper published diagnosed breast cancer result chemo egg fried also since live red state abortion illegal except save pregnant person life burn rubber driving airport hop plane sanity prevailed abortion still legal
I'm not scare mongering.. Essure has been on the news multiple times in the NYC area over the past year because they are burying how many issues there are and how bad.. Not to mention the pregnancies that are also happening despite it.,childfree,2016-11-13 16:32:32,scare mongering news multiple time nyc area past year burying many issue bad mention pregnancy also happening despite
"I got a 404 error, but I wasn't requesting the desktop version, so maybe that's why. 

Male contraceptive would be really neat. I know that most CF men would probably still like to get a permanent procedure, though. Same way how most CF gals would prefer an essure or tubal over pills or an IUD.


Also, congrats OP!",childfree,2014-04-26 18:29:01,got error requesting desktop version maybe male contraceptive really neat know cf men probably still like permanent procedure though way cf gal prefer tubal pill iud also congrats op
"At my Essure consultation, the doctor's first words were, ""So [another doctor] referred you to me for sterilization consultation, because you're done having kids and don't want any more?"" But later she asked me how many kids I have, I said I'm childfree, and she didn't question my choice at all. So overall still good experience.",childfree,2015-10-30 22:28:23,consultation doctor first word another doctor referred sterilization consultation done kid want later asked many kid said childfree question choice overall still good experience
"*Once again*, all I suggested he do is get a second opinion. If this was cancer, encouraging him to get a second opinion would be a perfectly logical piece of advice. 

As far as female sterilization...maybe ask the women who were maimed by Essure if sterilization is “low risk”? And maybe ask all of the low income/First Nations/disabled women who were sterilized against their will if it was the best thing for them? 

And no, female birth control is absolutely not low risk. Women have been socialized to accept pain and illness as “just part of being a woman” but it doesn’t mean it’s actually low risk....unless you’re indifferent chronic low to medium grade pain, mental health issues, and countless other side effects. 

I had my IUD removed because it was exacerbating my depression to the point of being suicidal. It also gave me terrible cramps. I waited a year and a half and got to the point of not getting out of bed before I finally had it removed. But since I didn’t get pregnant and it didn’t perforate my uterus, I guess my experience doesn’t count? Just part of being a woman, right? Same for the hundreds of thousands of women who’ve experienced the same or worse. There are millions stories that have been systemacially ignored and silenced for decades in the name of progress. I’m stunned that the myth of “low risk birth control” is being pushed on this page. ",birthcontrol,2018-11-21 12:42:15,suggested second opinion cancer encouraging second opinion perfectly logical piece advice far female sterilization maybe ask woman maimed sterilization low risk maybe ask low woman sterilized best thing female birth control absolutely low risk woman socialized accept pain illness part woman mean actually low risk unless indifferent chronic low medium grade pain mental health issue countless side effect iud removed exacerbating depression point suicidal also gave terrible cramp waited year half got point bed finally removed since pregnant perforate uterus guess experience count part woman right hundred thousand woman experienced worse million story systemacially ignored silenced decade name progress stunned myth low risk birth control pushed page
"
There's other options of permanent BC other than essure. You can get your tubes cauterised or removed completely. ",childfree,2016-11-17 02:22:24,option permanent bc tube cauterised removed completely
"I was told that because if cancer is a possibility, most cancers form in the Fallopian tubes so instead of just clipping / cauterizing they just outright prefer to remove the tubes to reduce the risk of cancer.

But I'm okay with the Essure method, less downtime. ",childfree,2016-05-05 23:44:28,told cancer possibility cancer form fallopian tube instead clipping cauterizing outright prefer remove tube reduce risk cancer okay method less downtime
"I searched your general area, &amp; I did notice your Dr. Asshat on the Essure site. :/ Maybe they'd be interested to know you specifically requested Essure &amp; were turned down without a real reason. Fortunately, there are other doctors (&amp; PP) listed there, so hopefully you can find someone good.",childfree,2013-05-10 19:44:29,searched general area amp notice asshat site maybe interested know specifically requested amp turned without real reason fortunately doctor amp pp listed hopefully find someone good
"Sounds like the nurse doesn't know what she is talking about.   There is no recommendation in any Essure literature about the confirmation test having to be a scheduled at a particular time, except 3 months after the procedure. 

Try again and if you can't get anyone who has a clue, go through your doctor's office.  The tests are different and you don't want the wrong one. 

*edit: there are recommendations that the procedure be preformed at cycle days 1-14 for pregnancy reasons, but it's a recommendation and not a requirement.",childfree,2014-11-05 05:19:34,sound like nurse know talking recommendation literature confirmation test scheduled particular time except month procedure try ca anyone clue doctor office test different want wrong one edit recommendation procedure preformed cycle day pregnancy reason recommendation requirement
"Preach!

Not too long ago, I had a doctor ask me if I had plans to ""start a family"".  The thing is, she knew I'd had Essure and I'd just finished chemo, so I'm barren as the Sahara.  I simply pointed at my husband (this was pre-COVID, so you could have someone accompany you to appointments, and I like to have him with me as a second set of ears) and I said, ""We are a family.  A family of two.""  We were actually a family of three at the time (we had a cat) and we've since adopted another kitty so we're a family of four now.

A family does NOT necessarily have to include a child.",childfree,2020-11-06 20:09:03,preach long ago doctor ask plan start family thing knew finished chemo barren sahara simply pointed husband someone accompany appointment like second set ear said family family two actually family three time cat since adopted another kitty family four family necessarily include child
"I would definitely ask them to explain why they can’t solely take your tubes, because that is a procedure that can be done.  It could be that the Essure has caused problems that affect your uterus as well and would make removing just the tubes risky or not possible.  Do ask for a detailed explanation.  If they don’t give you one or tell you that it is just what is usually done, please find a different surgeon.  It is not a forgone conclusion that they take both.",hysterectomy,2020-12-29 13:44:06,definitely ask explain solely take tube procedure done caused problem affect uterus well removing tube risky possible ask detailed explanation give one tell usually done please find different surgeon forgone conclusion take
"Congrats! I had it done back in March, and loved it, at least for the time i had it.... yeah... couple weeks after the HSG confirmed i was sealed up and good to go, being the freak of nature that i am, I expelled a coil. My gyno contacted Conceptus (makers of Essure) and i am the first reported case they have of this ever happening. (Go me! freak!)  They have to file an adverse reaction (?) report to the FDA... something like that anyway... So, I just had a tubal done... Essure was SO MUCH easier.... really wish i wasn't a freak of nature! Now i have little incision scars...they should fade over time... but still.

btw-- the HSG was a breeze for me-- zero pain what so ever. Don't worry about it, I bet you will be fine. 

Congrats again!",childfree,2011-08-31 15:27:22,congrats done back march loved least time yeah couple week hsg confirmed sealed good freak nature expelled coil gyno contacted conceptus maker first reported case ever happening freak file adverse reaction report fda something like anyway tubal done much easier really wish freak nature little incision scar fade time still btw hsg breeze zero pain ever worry bet fine congrats
"I had mine 3 weeks ago. One fibroid, no other significant issues, but I had a Essure  that I could feel and a uterine ablation that scarred my uterus shut. Because they couldn't get in to biopsy, they took it out.  No regrets. I had a colposcopy that hurt so bad I hyperventilated from the pain. I will never have to have another one of those! I am so happy with my decision.",hysterectomy,2022-04-01 02:40:26,mine week ago one fibroid significant issue feel uterine ablation scarred uterus shut biopsy took regret colposcopy hurt bad hyperventilated pain never another one happy decision
"I totally understand the doctor's side as well. I am also aware that I am not a loose twenty something that doesn't want babies because I am ""having fun"" with life. I relate more to 65 year olds than twenty somethings. I never lived the rowdy life yet still know that I don't want children. I don't like them, have no maternal instincts or desires and would be miserable. I do understand that they need to cover their backs as doctors but it aggravates me that a person that I have met twice in my life thinks they know me better than I know myself. 

 I just think that if I found a person who is genuinely thrilled to marry me fully knowing that he won't be getting children in his life, we should be able to life that life. Hormonal birth control pills really really mess with my body badly making my emotions go all over the place while my cycles always seem to be unpredictable. I am currently decided on trying the shots until I figure out the whole essure issue. I know that he getting a vasectomy would be easier but he had a really bad hernia in his nether regions for many years. Despite the fact that he got the necessary surgery to fix it, he is basically suffering PTSD about any other surgical procedures anywhere near that area, associating it with massive amounts of fear and pain. ",childfree,2013-10-27 05:09:15,totally understand doctor side well also aware loose twenty something want baby fun life relate year old twenty somethings never lived rowdy life yet still know want child like maternal instinct desire miserable understand need cover back doctor aggravates person met twice life think know better know think found person genuinely thrilled marry fully knowing wo child life able life life hormonal birth control pill really really mess body badly making emotion place cycle always seem unpredictable currently decided trying shot figure whole issue know vasectomy easier really bad hernia nether region many year despite fact got necessary surgery fix basically suffering ptsd surgical procedure anywhere near area associating massive amount fear pain
"Are you referring to anesthesia?  My parents were anesthesiologists.

My husband was awesomesauce after my breast cancer surgery, and also after my Essure (he wasn't happy about it but he drove me to the doctor's office and back home).",childfree,2020-08-27 04:46:07,referring anesthesia parent anesthesiologist husband awesomesauce breast cancer surgery also happy drove doctor office back home
"Most sterilizations do not remove the ovaries, which control the hormones involved in cycling, so other than your own personal feelings of relief, lack of worry, etc., you're not going to see any changes in your mood or body. That is assuming that you were not on hormonal contraception prior to sterilization--there will obviously be changes in your body and mood and cycle if you stop taking that. 

That was the kicker for me--I can't really function without hormonal birth control and sterilization won't do anything about the main reason I take/took it--which was to make my life livable. Also, when it came down to it, I really was uncomfortable with removing my ability to make a choice about kids. I choose not to have kids, I don't want to ever say otherwise, you know?

I ended up with the Mirena IUD. I went to the doc to talk about sterilization and long term options and while she was happy to talk about permanent options for me, she did admit that her office required her to have her patients like me jump through some hoops before the procedure was approved. Since I have to be on hormonal birth control anyway, the Mirena was the best option. It has a lower fail rate than a tubal and a slightly higher fail rate than Essure, plus my options are always open, even if I don't ever take advantage of that. ",childfree,2013-12-20 16:46:14,sterilization remove ovary control hormone involved cycling personal feeling relief lack worry going see change mood body assuming hormonal contraception prior sterilization obviously change body mood cycle stop taking kicker ca really function without hormonal birth control sterilization wo anything main reason life livable also came really uncomfortable removing ability choice kid choose kid want ever say otherwise know ended mirena iud went doc talk sterilization long term option happy talk permanent option admit office required patient like jump hoop procedure approved since hormonal birth control anyway mirena best option lower fail rate tubal slightly higher fail rate plus option always open even ever take advantage
