body,subreddit_comment,created_utc_comment,Processed_body
"Bilateral salpingectomy at 23. This is a full removal of the Fallopian tubes, and it is the only procedure (besides a flat-out hysterectomy) that I would have agreed to, no matter how much more time it took.


It took me about 1 year of talking to doctors and spreading my personal letter around local medical facilities (many of which offered Essure only...nope). I eventually got my surgery from a doc listed in the sidebar, who gave me no trouble (then again, I had my letter and her colleague was there at the consultation, too. Thankfully he was impressed!). 


Actual surgery was pretty smooth. Came in the early morning and was home later that afternoon, with lots of drugs and little pain. I took one day off work, then was slower for about 1 week and 100% fresh in 1.5 weeks. I'm a HUGE walker (4-10 miles/day), so I was trying to push it again on day 2, which may or may not have been wise.


No long-term physical effects to speak of, although there were some weird (ovulation-related? phantom tubish?) twinges inside for a while. They didn't hurt much at all. Sex is fantastic.


One more thing I feel compelled to share is that I _did_ have an unusual amount of anxiety for a few months after, without _ever_ having been on any hormonal birth control before that (in fact, yes - I refused to even lose my virginity before this surgery :P ).

**Now, I do not generally believe in post-tubal ligation syndrome, which seems like an invention of money-hungry reversal clinics and the sexist establishment (""ohhh, you'll be sooo saddddd about losing your puuurpose."" Disgusting and insulting.)**

BUT, this was a very difficult and seemingly chemical bout of mental unhappiness. It was very, very bad anxiety and I felt like a clingier, paranoid, miserable version of myself for hours at a time, 5-6 times per week. I wondered if it was remotely possible that removing the tubes gave a little poke or interruption to my ovaries and their brain-affecting chemicals, which took some time to even out (hence the twinges also?). 

BUT, again, I am no medical professional, and there were MANY confounders. For one thing, I work at a startup, which can be super stressful. For ANOTHER thing, I have always battled disordered eating habits for unrelated reasons, and I had started to eat insufficient lunches again around that time (hungry or even starving = more anxious). For yet ANOTHER thing, I'm in New England and we were starting winter, so it was goddamn cold and dark by 4:30 PM.

I am sorry to ramble, but figure it's best to put it all out there. I, for one, made sure to eat better again and have been doing immensely better (plus summer came). Overall, it was worth it in my case. 

Good luck in your decision and its execution! :-)",childfree,2016-09-24 16:40:42,bilateral salpingectomy full removal fallopian tube procedure besides hysterectomy agreed matter much time took took year talking doctor spreading personal letter around local medical facility many offered nope eventually got surgery doc listed sidebar gave trouble letter colleague consultation thankfully impressed actual surgery pretty smooth came early morning home later afternoon lot drug little pain took one day work slower week fresh week huge walker trying push day may may wise physical effect speak although weird phantom tubish twinge inside hurt much sex fantastic one thing feel compelled share unusual amount anxiety month without hormonal birth control fact yes refused even lose virginity surgery p generally believe ligation syndrome seems like invention reversal clinic sexist establishment ohhh sooo saddddd losing puuurpose disgusting insulting difficult seemingly chemical bout mental unhappiness bad anxiety felt like clingier paranoid miserable version hour time time per week wondered remotely possible removing tube gave little poke interruption ovary chemical took time even hence twinge also medical professional many confounders one thing work startup super stressful another thing always battled disordered eating habit unrelated reason started eat insufficient lunch around time hungry even starving anxious yet another thing new england starting winter goddamn cold dark pm sorry ramble figure best put one made sure eat better immensely better plus summer came overall worth case good luck decision execution
"I'm of the opinion everybody should be responsible for their own birth control and not rely on their partner for it. Besides, if she got a tubal or Essure she could also get an ablation to stop having periods. They usually won't do one without permanent sterilization.",childfree,2016-03-23 16:01:45,opinion everybody responsible birth control rely partner besides got tubal also ablation stop period usually wo one without permanent sterilization
"Is this is first and only time this has happened with Nexplanon? It could just be a break out. Though, if you have acne problems with other hormonal options that could be an issue you will continue to see. I didn't want to do the IUD route so I got Essure. It's as permanent as it gets though, so they probably won't do it if you're still young. ",birthcontrol,2013-10-11 00:55:01,first time happened nexplanon break though acne problem hormonal option issue continue see want iud route got permanent get though probably wo still young
"Massive?  It's not that bad and one can always go the Essure route.

The only massive part is trying to find someone to do it.",childfree,2015-09-09 13:02:58,massive bad one always route massive part trying find someone
This is actually horrifying. Looking more and more forward to my upcoming Essure procedure....,childfree,2015-03-30 22:20:47,actually horrifying looking forward upcoming procedure
"I agree, why can't they do a standard form?  You tell the Dr. you want Essure, tubal, etc. He/She gives you all information about it being permanent blah blah, he/she gives you a form stating your Dr. has advised that you can't reverse blah blah, Dr. isn't liable blah blah, can't sue if mind his changed, blah blah.  You sign it then you schedule your damn appointment because it's my damn body and I get to decide what I do with it.  You did your par,t now you are waive of all liability, make it so I can't have babies!  Simple, done, no one has a Dr. make that choice for them ever again.  And these poor Dr. don't have to be terrified that someone is going to change their mind and try to sue.  ",childfree,2015-03-11 13:37:12,agree ca standard form tell want tubal etc give information permanent blah blah give form stating advised ca reverse blah blah liable blah blah ca sue mind changed blah blah sign schedule damn appointment damn body decide par waive liability ca baby simple done one choice ever poor terrified someone going change mind try sue
"So glad I'm going on two years of Essure with no issues. Though I might talk to my husband about getting snipped just in case the unthinkable would happen. He can't really afford the time off work/light duty though. We do heavy manual labor.

Also, this is going to kill women. You're implanting something dead into the uterus where it has the chance to rot and cause sepsis. The body does not always expel things like that naturally. I had to have a D&amp;C after a medical abortion because a bunch of ""debris"" (as they called it) were literally rotting in my uterus and causing me continue bleeding heavily for weeks.

They literally want to kill women.",childfree,2019-05-14 16:14:03,glad going two year issue though might talk husband snipped case unthinkable happen ca really afford time duty though heavy manual labor also going kill woman implanting something dead uterus chance rot cause sepsis body always expel thing like naturally amp c medical abortion bunch debris called literally rotting uterus causing continue bleeding heavily week literally want kill woman
"I named my essure coils instead ;) Capt. Slinky and Bob Wire

way cooler than having kidlets",childfree,2012-11-19 02:05:26,named coil instead capt slinky bob wire way cooler kidlets
Why not both? I have Essure and my SO wants a vasectomy. But to each their own.,childfree,2014-01-15 16:53:15,want vasectomy
"Those were actually what I'd looked at originally! Because they didn't have hormones, I knew they should be okay. My biggest concern (at that point) was the spotting they cause. I used to track my period like a hawk and if anything was off I'd panic.

Which was why my GYN and I talked about Essure. Quick easy, permanent. But...I forgot I have issues m with metal allergies; piercings reject badly. That ruled out Essure and copper forms of birth control. 

Ultimately, we decided on salpingectomy based off of CF status and history of cancer, and ablation to be on the safe side plus to deal with heavy periods. I couldn't be happier!",childfree,2015-12-13 22:59:59,actually looked originally hormone knew okay biggest concern point spotting cause used track period like hawk anything panic gyn talked quick easy permanent forgot issue metal allergy piercings reject badly ruled copper form birth control ultimately decided salpingectomy based cf status history cancer ablation safe side plus deal heavy period happier
My doctor was uncomfortable with how new Essure was when we consulted about permanent options about two years ago. She was also way in favor of him having a vasectomy over me having to go through anything.... I wanted both of us to have procedures done because I AM DONE HAVING CHILDREN!!!,Parenting,2012-02-04 00:31:36,doctor uncomfortable new consulted permanent option two year ago also way favor vasectomy anything wanted u procedure done done child
"&gt; Essure are nickel-clips that tie your tubes

No, it's a coil that you put into the fallopian tube to cause damage and scar tissue formation as a method of occlusion from the inside. The Filshie clip is actually a clip and ties the tube from the outside when placed on the tube. ",childfree,2017-01-04 17:55:06,gt tie tube coil put fallopian tube cause damage scar tissue formation method occlusion inside filshie clip actually clip tie tube outside placed tube
I live in Austin and my doctor has no problem sterilizing me. I was 22 or 23 when I first brought it up (25 now) and she said they just make you wait a year to make sure you won't change your mind. Since I brought it up years ago (and at every appointment since then) she's just waiting for me to decide to do it. My phobia of needles is the only reason I'm putting it off right now but once the new Essure is approved I'm diving in. Yeah Austin doctors!,childfree,2014-09-18 05:54:32,live austin doctor problem sterilizing first brought said wait year sure wo change mind since brought year ago every appointment since waiting decide phobia needle reason putting right new approved diving yeah austin doctor
"Do they put each Essure coil in separately, or does the tool allow for the doctor to pass it through your cervix only once (twice if you count removing the tool)?",childfree,2015-01-17 01:05:36,put coil separately tool allow doctor pas cervix twice count removing tool
I'm not OP but you just reminded me to add my doctor! I don't know if she does essure/tubals or not but she is fine with giving IUDs to young women who have not been pregnant/are childfree.,childfree,2013-11-08 04:01:21,op reminded add doctor know fine giving iud young woman childfree
Hugged the pup and the cat! Love my 4 legged babes and my Essure!,childfree,2014-05-12 03:37:19,hugged pup cat love legged babe
"I'm mildly allergic to nickel, I didn't want an implant, and I've heard lots of women have problems with Essure. Not to say you will, I just didn't want to risk it.

I was a little nervous about being put under, but I had a great team of anesthesiologists who were super reassuring and make all my nerves go away before I even got to the operating room. I hope your procedure goes well, I'd love to hear about your experience!",TwoXChromosomes,2016-08-27 11:48:26,mildly allergic nickel want implant heard lot woman problem say want risk little nervous put great team anesthesiologist super reassuring nerve away even got operating room hope procedure go well love hear experience
"Not really. 

1. A tubal ligation and a vasectomy both have the same recovery time 2-4 days. 

2. Vasectomy has the risk of chronic pain and a tubal does not (real research support this).

3. Only difference between the two is a tubal requires general anesthesia. However, Essure does not. So if that is your only point against her getting a tubal, she can get Essure. ",childfree,2014-07-26 10:53:54,really tubal ligation vasectomy recovery time day vasectomy risk chronic pain tubal real research support difference two tubal requires general anesthesia however point tubal
"Aw, you got stoned? I'm jealous. All I got was queasy. ([This is my write-up of my Essure experience if you're interested](http://www.reddit.com/r/childfree/comments/25k58r/i_got_essure_in_a_hospital_yesterday/).)",childfree,2014-12-20 06:12:38,aw got stoned jealous got queasy experience interested
"Ive been very hesitant to consider essure for this reason, iveheard a lot of women got painful complications plus id rather the tubrs were just gone instead of stuffed with scar tissue.",childfree,2014-09-12 17:41:33,ive hesitant consider reason iveheard lot woman got painful complication plus id rather tubrs gone instead stuffed scar tissue
