body,subreddit_comment,created_utc_comment,Processed_body
"Sorry, but you don't have to be a dick about it.

I'm 22F and struggling to convince myself to get an IUD due to the nightmare stories I've heard. I love the birth control pill, but still don't feel like it's reliable enough for my childfree endeavors.

I wanted to get essure, but need to talk myself into the pain of the process (apparently the checkup is infinitely more painful for most women than the initial procedure).

Nor do I favor the idea of having anything inserted inside my uterus no matter how much I dislike children.

It's much easier to swallow a pill daily than it is to to have something implanted inside of your fucking vagina.

So yeah. Not everybody is tough and self-righteous. 

Don't be a dick. ",childfree,2016-02-16 00:22:51,sorry dick struggling convince iud due nightmare story heard love birth control pill still feel like reliable enough childfree endeavor wanted need talk pain process apparently checkup infinitely painful woman initial procedure favor idea anything inserted inside uterus matter much dislike child much easier swallow pill daily something implanted inside fucking vagina yeah everybody tough dick
"Unfortunately, if he doesn't back down, you'll have to leave him. 

If you don't leave him, he'll either A) Leave you or B) Become abusive and controlling to get a baby from you. 

It just won't work. You can keep it going for a while, but eventually you'll have to put your foot down before he does. 

Get an appointment to get your tubes tied or Essure so he knows you're serious. 

Good luck. You're not alone, we're here for you! :)  

",childfree,2013-02-05 21:38:12,unfortunately back leave leave either leave b become abusive controlling baby wo work keep going eventually put foot appointment tube tied know serious good luck alone
"I had my Essure done last month (about a week before I turned 26). Prior to doing so I talked to my fiance (who also doesn't want children) and told him this is for sure happening, never any children. He was on board, and my mom is the one that drove me to and from the appointment. (Which is awesome, since I had to be there incredibly early, and she lives an hour away.) Most of my family and friends don't know for sure that I'm never having children. Anytime kids are brought up I tell them I don't want them, but they just brush it off. My father still doesn't know I had the procedure done (we don't have the best relationship.)

Congratulations to you! If you have any questions, there are tons of people on here that have had, or are looking into the procedure. After I had mine done, /u/sexychippy was extremely helpful (she works in an OR) with any questions that were coming in my post. 

All the best!!",childfree,2013-04-09 19:02:39,done last month week turned prior talked fiance also want child told sure happening never child board mom one drove appointment awesome since incredibly early life hour away family friend know sure never child anytime kid brought tell want brush father still know procedure done best relationship congratulation question ton people looking procedure mine done extremely helpful work question coming post best
"Check /r/childfree and /r/sterilization 

Here is mine:

I was late 20s, married, no kids and I wanted to find a more permanent birth control method. So I started researching what the procedure ""tying your tubes"" entailed / read a ton of experiences after my Paragard partially expelled at one year.   

I decided on a tubal ligation with Filshie clips. It has the best effective rate I could find (lifetime average effective rate of 99.75% see: http://www.ncbi.nlm.nih.gov/pubmed/16259814 or http://www.ncbi.nlm.nih.gov/m/pubmed/24560346/?i=1&amp;amp;amp;amp;from=filshie%20clips)

So I scheduled an appointment with my OBGYN, she is on the younger side and very openminded (there is a link in the sidebar to open minded doctors if you don't have a open minded OBGYN). We had a 30 minute conversation and she agreed that I was well researched / she was comfortable I understood it was permanent. After the consult, I discussed with her scheduling nurse when I would prefer to schedule it (it was around 3 months out). 

Cost: During my research, I triple checked the ACA law required the insurance to 100% cover it. I paid about $10 for the at home pain pills. So in *total* it cost me only $10.00! Check out www.coverher.org for info about that! 

Pre-Op:

Since it was scheduled 3 months after the consult the hospital required my doctor to do a Pre-Op with me. So week of procedure I had a Pre-Op apt with my Doctor. Basically just a quick check of everything. I asked whether I needed a catheter and she doubted I would. She gave no restrictions as to sex or exercise and just resume when comfortable. Got my pain prescriptions and pre-filled them so I could go straight home after my tubal ligation. Definitely ask to get them pre-filled. 

Procedure: 

It was scheduled for 8:00 am on Friday. Hospital told me to check in at 6-6:15 am for paperwork / prep. Paperwork was just double checking everything (copy of insurance card / etc). Walked to a private mini hospital room and Nurse started intake / asking health questions (when did I eat last, what medications/ etc) and changed into the hospital gown and signed my sterilization consent form. Doctor also stopped by to chat before. I told the anesthesiologist that I get nauseous under general anesthesia so they put a patch behind my ear to help. Then one of the nurses gave me an IV (they numb the area first). I peed right before so I wouldn’t need a catheter (and I didn’t). The nurse then put blue leg warmers on my legs to help prevent blood clots (this is normal for any procedure). Around 8:00 am the anesthesiologist came and gave me valium through the IV. Later I was then rolled into the OR. I don't even really remember leaving the room - they have some good drugs :)

Post-OP:
I woke up wide awake in the recovery area. The patch worked so I was not nauseous. The nurse asked my pain scale and I was at a 3/10. It was basically a bad period cramp type of feeling, but no real ‘pain’ per se. The doctor came back and told me everything was normal and that the actual procedure took 15 minutes. She made the first incision into my belly button (but because she was so awesome no scar there). The second small incision is below my bikini line. She then went to talk to my husband to give him the details and tell him after care instructions. 

After 30 minutes or so I was moved into the big recovery area. The nurse brought me food and juice. My husband came in and was really surprised how awake and normal I was. After 30 minutes of being in the big recovery area, I got dressed by myself and left. We left around 10:00 am. 

Tips: Wear loose fitting PJs and a thin maxi pad. Bring a bottle of water to drink after as your throat is sore. Have a pillow in the car for the seat belt. 

At-Home Recovery:

Friday: 
I went home and slept. I could walk around fine, I was just tired. I walked up the stairs to my bedroom by myself. My tummy was a tiny bit inflated by the gas they use to see what they are doing in there, but nothing crazy, it just looked like I had eaten a big meal / slight bloat. 
The pain pills made more tired so I just slept the rest of the day. I late lunch and dinner normally. 

Saturday and Sunday: 
The rest of the weekend, I just watched TV with my husband. I could do stuff, I just chose to relax. Basically it was just a lazy weekend. Have some good movies and shows to watch. I was sore, but just like too many sit-ups sore. I could have done errands if I needed to, but with the pain pills you aren't suppose to drive.

Monday:
I went back to work on Monday. No prescription pain pills and just did over the counter stuff Monday and Tuesday. No one even guessed anything :) The worst thing was really from the IV (big bruise as my veins hate IVs) but just wore long sleeve shirts for a few days. 

Tips: Heating pad for tummy and Popsicles for your throat. 

Summary: It was way simpler and easier than I thought! I have one tiny 1/2 inch scar below my bikini line that faded. The tubal ligation was the best thing I ever did! 

P.S. Don't fall for the fake ""Post Tubal ligation Syndrome."" The 'doctor' that created it, lost her license (http://www.casewatch.org/board/med/hufnagel/order_2004.shtml or http://caselaw.findlaw.com/ca-court-of-appeal/1230512.html) for being crazy.

Neither a tubal ligation (tubes tied),  bilateral salpingectomy (tube removal), nor Essure (blocking your tubes) will effect your hormones. Women usually  stop hormonal birth control when they get their tubes tied. As in they return to their natural period. Hormonal birth stops your cycle so you neither ovulate nor have a period so when you are on it you have a lighter fake bleed. Correlation is NOT causation.

Some of the research disproving the fake syndrome - they didn't even find correlation, let alone causation: http://www.ncbi.nlm.nih.gov/pubmed/7982548 http://www.ncbi.nlm.nih.gov/pubmed/11106717 http://www.ncbi.nlm.nih.gov/pubmed/15865627 http://www.ncbi.nlm.nih.gov/pubmed/23071889

Why? Because it can't /won't restrict the blood flow after surgery. This explains it quite well...
https://www.google.com/amp/s/drjengunter.wordpress.com/2012/06/07/tubal-ligation-does-not-cause-early-menopause-beware-the-hormone-experts/amp/?client=safari
",birthcontrol,2017-05-16 16:06:56,check mine late married kid wanted find permanent birth control method started researching procedure tying tube entailed read ton experience paragard partially expelled one year decided tubal ligation filshie clip best effective rate find lifetime average effective rate see amp amp amp amp scheduled appointment obgyn younger side openminded link sidebar open minded doctor open minded obgyn minute conversation agreed well researched comfortable understood permanent consult discussed scheduling nurse prefer schedule around month cost research triple checked aca law required insurance cover paid home pain pill total cost check info since scheduled month consult hospital required doctor week procedure apt doctor basically quick check everything asked whether needed catheter doubted gave restriction sex exercise resume comfortable got pain prescription straight home tubal ligation definitely ask procedure scheduled friday hospital told check paperwork prep paperwork double checking everything copy insurance card etc walked private mini hospital room nurse started intake asking health question eat last etc changed hospital gown signed sterilization consent form doctor also stopped chat told anesthesiologist nauseous general anesthesia put patch behind ear help one nurse gave iv numb area first peed right need catheter nurse put blue leg warmer leg help prevent blood clot normal procedure around anesthesiologist came gave valium iv later rolled even really remember leaving room good drug woke wide awake recovery area patch worked nauseous nurse asked pain scale basically bad period cramp type feeling real pain per se doctor came back told everything normal actual procedure took minute made first incision belly button awesome scar second small incision bikini line went talk husband give detail tell care instruction minute moved big recovery area nurse brought food juice husband came really surprised awake normal minute big recovery area got dressed left left around tip wear loose fitting pjs thin maxi pad bring bottle water drink throat sore pillow car seat belt recovery friday went home slept walk around fine tired walked stair bedroom tummy tiny bit inflated gas use see nothing crazy looked like eaten big meal slight bloat pain pill made tired slept rest day late lunch dinner normally saturday sunday rest weekend watched tv husband stuff chose relax basically lazy weekend good movie show watch sore like many sore done errand needed pain pill suppose drive monday went back work monday prescription pain pill counter stuff monday tuesday one even guessed anything worst thing really iv big bruise vein hate iv wore long sleeve shirt day tip heating pad tummy popsicle throat summary way simpler easier thought one tiny inch scar bikini line faded tubal ligation best thing ever fall fake post tubal ligation syndrome created lost license crazy neither tubal ligation tube tied bilateral salpingectomy tube removal blocking tube effect hormone woman usually stop hormonal birth control tube tied return natural period hormonal birth stop cycle neither ovulate period lighter fake bleed correlation causation research disproving fake syndrome even find correlation let alone causation ca restrict blood flow surgery explains well http
"To put in IUDs they want you to be on your period, for Essure they want it to have just finished.",childfree,2012-11-27 16:38:47,put iud want period want finished
"This is a pretty appropriate sub to do that, seeing as how many of the threads are based around preventing pregnancy. Not really that much different than people posting about BC pills/Essure/tubals.",childfree,2014-08-19 19:31:15,pretty appropriate sub seeing many thread based around preventing pregnancy really much different people posting bc
"Yeah, that's my thought about why they aren't offering it as well. Even surgical abortion is mostly done with ""twilight"" sedation and/or local anesthesia. The only female sterilization option (that I know of) that could be done with local was Essure, and that's been pulled off the market. I wish their were more options, both for sterilization procedures and places that could offer it, but anatomy being what it is...",childfree,2020-05-24 21:59:24,yeah thought offering well even surgical abortion mostly done twilight sedation local anesthesia female sterilization option know done local pulled market wish option sterilization procedure place offer anatomy
"1.A tubal ligation or Essure will do NOTHING to your hormones as it just closes a passageway and does not effect your ovaries. 

And look at actual/real studies, that show post tubal ligation syndrome (PTLS) is bullshit. 

Some of the research: 
http://www.ncbi.nlm.nih.gov/pubmed/7982548 
http://www.ncbi.nlm.nih.gov/pubmed/11106717
http://www.ncbi.nlm.nih.gov/pubmed/15865627

2.**Why would you remove your ovaries? That fucks you up!** 

Edit: If the only reason is that you want to stop your period, a doctor won't approve ovary removal as that is negligent territory for the doctor. You do realize you can get Endometrial ablation (non-hormonal) to stop periods? http://m.novasure.com/index.html",childfree,2015-05-13 22:19:50,tubal ligation nothing hormone close passageway effect ovary look study show post tubal ligation syndrome ptls bullshit research remove ovary fuck edit reason want stop period doctor wo approve ovary removal negligent territory doctor realize endometrial ablation stop period
"I had mine inserted in July 2015. I don't really remember the pain to be honest. It was more like a really bad period cramp, which I was used to already. I was basically in and out and it was no big deal.

But I honestly want to and plan to get mine removed.

I had terrible, terrible cramps for the first three months. I was a server at the time and I have a pretty high pain tolerance, but these cramps would stop me in the middle of the dining room or serving aisle and I would double over in pain until it subsided. 

I also had terrible acne on my face up until about November. Deep, cystic acne. It left a lot of dark marks on my face. While my face has calmed down and I'm currently only getting small white heads, the cystic acne has moved to my shoulders and the center of my back. 

I had minor spotting for about fourth months but I primarily experienced a large amount of discharge. All the time. Non stop. The discharge ended up getting a fowl, rotting smelling odor. I went to my doctor twice for this, two rounds of antibiotics, but they never found any trace of infection. Usually just tiny traces of yeast but not enough to be concerned about. But I was prescribed the antibiotics anyway, as a precaution, and round two of them did take away the odor and eventually the discharge.

I was ""dry"" for all of November and December and the first half of January. The other day I randomly started cramping and getting discharge again. I then spotted once this past Monday. And now an odor is back. Although it smells like a bad cheese this time. I don't know if that's because I'm having a false period of sorts or what is causing it. 

I will be switching to a new insurance here very soon and it looks like they cover Essure so I will be looking into that (because I don't want kids). But as soon as my insurance is all sorted out, I will be going back to the doctor to get this thing removed (and probably another round of antibiotics). It's been nothing but a terrible pain in the ass.

I'm not trying to scare you, this is just my experience. And everyone's bodies react differently. I have a handful of piercings and all healed up with no issues so my thinking going into this was ""My body hasn't reacted to foreign objects. Mirena should be fine."" And that wasn't the case. Unfortunately, I experienced a lot of the bad stories I read online.

If your insurance will cover yours, I would recommend it simply because you're always going to hear/read more bad stories than good when searching online. It could be the best choice you make.",birthcontrol,2016-01-20 19:30:12,mine inserted july really remember pain honest like really bad period cramp used already basically big deal honestly want plan mine removed terrible terrible cramp first three month server time pretty high pain tolerance cramp stop middle dining room serving aisle double pain subsided also terrible acne face november deep cystic acne left lot dark mark face face calmed currently small white head cystic acne moved shoulder center back minor spotting fourth month primarily experienced large amount discharge time non stop discharge ended fowl rotting smelling odor went doctor twice two round antibiotic never found trace infection usually tiny trace yeast enough concerned prescribed antibiotic anyway precaution round two take away odor eventually discharge dry november december first half january day randomly started cramping discharge spotted past monday odor back although smell like bad cheese time know false period sort causing switching new insurance soon look like cover looking want kid soon insurance sorted going back doctor thing removed probably another round antibiotic nothing terrible pain as trying scare experience everyone body react differently handful piercings healed issue thinking going body reacted foreign object mirena fine case unfortunately experienced lot bad story read online insurance cover recommend simply always going bad story good searching online best choice
happened to me after being on the pill for more than twenty years. I terminated and had the essure procedure a while later. I wish I had done it years ago. ,childfree,2017-05-20 19:31:16,happened pill twenty year terminated procedure later wish done year ago
"Congrats on the snip! Though it can be hard to get sterilized young, I know my mum's ex-husband was able to get the snip years ago at age of 18 so it is possible. Personally, I got my 'tubes tied' (via Essure) at 24 :) ",childfree,2014-07-02 01:59:37,congrats snip though hard sterilized young know mum able snip year ago age possible personally got tied via
"If the inserts are metal coils, that's Essure. If the inserts are gels, it's probably Adiana.

Really sorry to hear about the insurance issues. I hope the out of pocket cost isn't too much. I fear it will be, though. I would have paid about $10K for my surgery without insurance. With insurance, it was like $450 (this was before ACA though).",childfree,2018-04-26 18:31:28,insert metal coil insert gel probably adiana really sorry hear insurance issue hope pocket cost much fear though paid surgery without insurance insurance like aca though
Or essure! Minimal recovery and just as effective.,childfree,2018-12-20 17:08:33,minimal recovery effective
"The FDA is reviewing Essure because of all the issues it's caused women, so I don't think you're alone. Congrats on getting fixed!",childfree,2016-03-23 00:16:43,fda reviewing issue caused woman think alone congrats fixed
"whoa... I said e**s**sure, not e**n**sure ;-)

http://www.essure.com/home",TwoXChromosomes,2015-03-05 13:00:08,whoa said e sure e n sure
"No they are, depending on place, Healthcare, and doctor themselves. The clips usually are done by doctors who believe you will change your mind. Sometimes it's done out of desperation because in America you don't have good Healthcare so it's the only one insurance will pay. Essure has be taken out from the market but some doctors who are behind still do it. Bisalp is the best but still struggles to be everywhere. The most often done ones are either clips or cutting small pieces and burning.

I'm glad you're getting the best, congratulations! And speed recovery",childfree,2021-03-05 21:57:08,depending place healthcare doctor clip usually done doctor believe change mind sometimes done desperation america good healthcare one insurance pay taken market doctor behind still bisalp best still struggle everywhere often done one either clip cutting small piece burning glad best congratulation speed recovery
"Essure isn't a surgery. And a tubal is far from ""serious"". It is a 15 minute procedure and a weekend recovery. My recovery was easier than my friend's vasectomy recover. 

To be CF you don't need to be sterilized, but OP is afraid of regret and thus can't say never. This isn't just a fear of the procedure. ",childfree,2015-01-23 11:04:45,surgery tubal far serious minute procedure weekend recovery recovery easier friend vasectomy recover cf need sterilized op afraid regret thus ca say never fear procedure
"Perhaps with an old school tubal ligation, or tubal clips, Essure, or uterine ablation.

But I have yet to see a medical paper with an ectopic pregnancy stemming from a hysterectomy or a bilateral salpingectomy. Which is why these procedures should be the standard, and bilateral salpingectomy is becoming more common in more areas for sterilization.

Edit: there had been a LOT of errors done with tubal ligation causing failure in either live births or ectopic pregnancies. Many surgeons would not cauterize the cut ends, tie ineffectively, or not cut out enough length of tube allowing recanalization.

 Basically, most ectopic pregnancies happened for the same reason as vasectomy failure: surgeon or procedure protocol error allowing for the tubes to reconnect.",childfree,2021-04-18 00:45:36,perhaps old school tubal ligation tubal clip uterine ablation yet see medical paper ectopic pregnancy stemming hysterectomy bilateral salpingectomy procedure standard bilateral salpingectomy becoming common area sterilization edit lot error done tubal ligation causing failure either live birth ectopic pregnancy many surgeon cauterize cut end tie ineffectively cut enough length tube allowing recanalization basically ectopic pregnancy happened reason vasectomy failure surgeon procedure protocol error allowing tube reconnect
"I have been researching Essure since April 2012. It can cause a lot of problems which require major surgery to fix. Flishies clips also have problems of migration. So I am againist foreign objects in the body especially since getting them removed is very costly and doctors do not know how to remove Essure. I have looked at xrays, surgery photos and read pathology reports every day for the last year. Essure should not be on the market. Essure problems exist read the fine print on migrations, heavy bleeding, pain, infection and pregnancy. You can get pregnant with essure even after confirming being blocked. However when pregnant with essure inside there is unknown possibilities that Bayer has no answers for. So they are treated as high risk pregnancies and many miscarriages occur. I would physically stop my worst enemy from getting essure. 
",childfree,2014-10-02 02:17:29,researching since april cause lot problem require major surgery fix flishies clip also problem migration againist foreign object body especially since removed costly doctor know remove looked xrays surgery photo read pathology report every day last year market problem exist read fine print migration heavy bleeding pain infection pregnancy pregnant even confirming blocked however pregnant inside unknown possibility bayer answer treated high risk pregnancy many miscarriage occur physically stop worst enemy
"I wish I could give you some wise words ... but you are braver than I am.

I chose not to tell my parents about my Essure procedure.  They were very strict Catholics, and I'm an only child, so I was their only hope for grandchildren.  They probably would have cut me out of the family if I'd come clean.  Instead, I just let them believe whatever they wanted to believe.

Congrats on getting approved, and I hope the surgery goes smoothly.",childfree,2019-10-30 03:30:26,wish give wise word braver chose tell parent procedure strict catholic child hope grandchild probably cut family come clean instead let believe whatever wanted believe congrats approved hope surgery go smoothly
